"Status","Start Time","Stop Time","Duration in ms","Parent Suite","Suite","Sub Suite","Test Class","Test Method","Name","Description"
"failed","Wed Sep 28 10:48:44 UTC 2022","Wed Sep 28 10:48:44 UTC 2022","161","","tests.spec.js","","","","TC-04: Should find the requested information using Redmine search",""
"failed","Wed Sep 28 10:48:38 UTC 2022","Wed Sep 28 10:48:38 UTC 2022","159","","tests.spec.js","","","","TC-01: Should sign in to Redmine with valid credentials",""
"failed","Wed Sep 28 10:48:42 UTC 2022","Wed Sep 28 10:48:42 UTC 2022","168","","tests.spec.js","","","","TC-03: Should sign up to Redmine with an already existing username",""
"failed","Wed Sep 28 10:48:46 UTC 2022","Wed Sep 28 10:48:46 UTC 2022","162","","tests.spec.js","","","","TC-05: Should check user password recovery on Redmine",""
"failed","Wed Sep 28 10:48:40 UTC 2022","Wed Sep 28 10:48:40 UTC 2022","165","","tests.spec.js","","","","TC-02: Should sign in to Redmine with invalid credentials",""
